{"$id":"https://surfaces.dev/schemas/spectrum-checkbox-catalog/spectrum-checkbox-catalog-fixture.v0.schema.json","$schema":"https://json-schema.org/draft/2020-12/schema","additionalProperties":false,"properties":{"componentId":{"anyOf":[{"const":"Checkbox"},{"type":"string"}]},"fixtureId":{"type":"string"},"policyText":{"anyOf":[{"type":"string"},{"type":"null"}]},"promotionRequest":{"anyOf":[{"type":"null"},{"enum":["allowed","review_required"]}]},"requestedAddition":{"anyOf":[{"type":"null"},{"enum":["action","event","slot","data-binding","variant","prop","token","executable-policy"]}]},"reviewScenario":{"anyOf":[{"type":"null"},{"enum":["standalone-label","activation-intent"]}]},"schemaId":{"const":"spectrum-checkbox-catalog-fixture.v0"},"selection":{"anyOf":[{"type":"null"},{"additionalProperties":false,"properties":{"isIndeterminate":{"type":"boolean"},"isSelected":{"type":"boolean"},"precedence":{"anyOf":[{"const":"indeterminate-over-selected"},{"type":"null"}]}},"required":["isSelected","isIndeterminate","precedence"],"type":"object"}]},"sourceRef":{"anyOf":[{"type":"string"},{"type":"null"}]},"stateMapping":{"anyOf":[{"type":"null"},{"additionalProperties":false,"properties":{"source":{"type":"string"},"target":{"type":"string"}},"required":["source","target"],"type":"object"}]},"tokenMode":{"anyOf":[{"type":"null"},{"enum":["desktop","mobile","unspecified"]}]},"version":{"const":"0.0.0"}},"required":["schemaId","version","fixtureId","componentId","sourceRef","stateMapping","tokenMode","selection","requestedAddition","policyText","reviewScenario","promotionRequest"],"type":"object"}