{"componentId":"Checkbox","fixtureId":"checkbox-complete","policyText":null,"promotionRequest":null,"requestedAddition":null,"reviewScenario":null,"schemaId":"spectrum-checkbox-catalog-fixture.v0","selection":{"isIndeterminate":false,"isSelected":false,"precedence":"indeterminate-over-selected"},"sourceRef":"spectrum-design-data://npm/@adobe/spectrum-design-data@0.7.0/package/components/checkbox.json#","stateMapping":{"source":"keyboard-focus","target":"keyboardFocus"},"tokenMode":"desktop","version":"0.0.0"}